"StateCode","SpecialClassDescription","DisplayValue","DataValue"
"CW","Other - Masonry or Metal or Other Non-combustible Materials, Stock or Equipment","1190","1190"
"CW","Other - Metal or Other Non-combustible Materials W Combustible Wrappings, or on Combustible Pallets","1190","1190"
"CW","Other - Materials, Stock or Equipment Which Are Combustible or Part Combustible","1190","1190"
"CW","Aircraft Stored in the Open","1190","1190"
"CW","Aircraft Beacons, Blinkers and Other Lighting Equipment - Metal Supports","1190","1190"
"CW","Aircraft Beacons, Blinkers and Other Lighting Equipment - Wood Supports","1190","1190"
"CW","Amusement Equipment in the Open (Commercial Enterprises) - Metal or Other Non-combustible Equipment","1190","1190"
"CW","Amusement Equipment in the Open (Commercial Enterprises) - Combustible Equipment","1190","1190"
"CW","Artificial Turf","1190","1190"
"CW","Awnings or Canopies (when Insured Separately) - Entirely Non-combustible, Including Supports","1190","1190"
"CW","Awnings or Canopies (when Insured Separately) - Other than Above","1190","1190"
"CW","Billboards and Signs (Not on Buildings) - Entirely Metal, Including Frame and Supports","1185","1185"
"CW","Billboards and Signs (Not on Buildings) - Other than Above","1185","1185"
"CW","Bleachers","1190","1190"
"CW","Boats, Dredges or Vessels on Land or Permanently Anchored","1190","1190"
"CW","Bridges, Aqueducts - Concrete, Including Supports and Deck","1200","1200"
"CW","Bridges, Aqueducts - Metal, Including Supports and Deck","1200","1200"
"CW","Bridges, Aqueducts - Wood or Part Wood","1200","1200"
"CW","Cooling Towers - Masonry","1190","1190"
"CW","Cooling Towers - Metal","1190","1190"
"CW","Cooling Towers - Wood","1190","1190"
"CW","Cordwood, Felled Timber, Stakes & RR Ties in Open, Not on Prem of a Lumber Mill or Bldrs Supply Yard","1190","1190"
"CW","Cranes and Other Heavy Machinery in the Open","1190","1190"
"CW","Drive in Theaters (Speakers and Screens Only) - Speakers","0833","0833"
"CW","Drive in Theaters (Speakers and Screens Only) - Screens - Concrete","0833","0833"
"CW","Drive in Theaters (Speakers and Screens Only) - Screens - Metal","0833","0833"
"CW","Drive in Theaters (Speakers and Screens Only) - Screens - Wood","0833","0833"
"CW","Electric Transformers in the Open Not Owned by a Public Utility - on Concrete Pads or Steel Supports","1190","1190"
"CW","Electric Transformers in the Open Not Owned by a Public Utility - on Wood Supports","1190","1190"
"CW","Electric Vehicle Charging Stations (Pole Mount or Pedestal; Not Wall Mounted)","1160","1160"
"CW","Exhibit Stands and Booths in the Open - Entirely Metal","1190","1190"
"CW","Exhibit Stands and Booths in the Open - Wood or Part Wood","1190","1190"
"CW","Explosives in the Open","1190","1190"
"CW","Fences and Arbors - Metal or Masonry","1190","1190"
"CW","Fences and Arbors - Wood","1190","1190"
"CW","Incinerators or Refuse Burners Which Are Not Part of a Building - Masonry Construction","1190","1190"
"CW","Incinerators or Refuse Burners Which Are Not Part of a Building - All Other Construction","1190","1190"
"CW","Machinery and Equipment in the Open - Processing Non-combustible Materials Only","1190","1190"
"CW","Machinery and Equipmt in the Open - Procg Combustible Materials Other than Hay, Straw or Fibers","1190","1190"
"CW","Machinery and Equipment in the Open - Processing Hay, Straw or Other Fibers","1190","1190"
"CW","Motion Picture Sets in the Open","1190","1190"
"CW","Nursery Stock in the Open - Trees, Shrubs, Plants, Flowers","1190","1190"
"CW","Oil Derricks","1190","1190"
"CW","Rafts and Other Floating Equipment, Also Portable or Movable Docks (Not Boats or Dredges)","1190","1190"
"CW","Reservoir Roofs","1190","1190"
"CW","Sawmills, Portable, in the Open","1190","1190"
"CW","Solar Panel Arrays - Freestanding (Not on Buildings), including strut support","1165","1165"
"CW","Stock Pens, Feed Pens, Feed Storing Pens, Corrals - Not Subject to Division Four - Farm","1190","1190"
"CW","Street Light Poles, Meters, Signs, Traffic Signals, Flagpoles, Alarm Boxes, Similar Equipmt - Metal","1190","1190"
"CW","Street Light Poles, Meters, Signs, Traffic Signals, Flagpoles, Alarm Boxes, Similar Equipmt - Wood","1190","1190"
"CW","Swimming Pools in the Open - Above Ground (Concrete or Metal)","1190","1190"
"CW","Swimming Pools in the Open - Above Ground (All Other)","1190","1190"
"CW","Swimming Pools in the Open - in Ground (Concrete or Metal)","1190","1190"
"CW","Swimming Pools in the Open - in Ground (All Other)","1190","1190"
"CW","Tanks, Bins and Silos - Tanks Below Ground, Covered with Earth","1190","1190"
"CW","Tanks, Bins & Silos - Tanks Above Grnd - Masonry Tanks on the Grnd, Masonry Tanks W Masonry Supports","1190","1190"
"CW","Tanks, Bins & Silos -Tanks Above Grnd -Steel Tanks on Grnd, Masonry or Steel Tanks on Steel Supports","1190","1190"
"CW","Tanks, Bins & Silos - Tanks Above Grnd - Wood Tanks or Tanks W Wood Supports (Incldg Wood Rsv Roofs)","1190","1190"
"CW","Tents and Fabric Covered Structures - Supported by Structural Metal Members","1190","1190"
"CW","Tents and Fabric Covered Structures - Air Supported Structures","1190","1190"
"CW","Tents and Fabric Covered Structures - All Other Fabric Covered Structures","1190","1190"
"CW","Towers - Broadcasting Antennas (Cell, Radio and TV)","1190","1190"
"CW","Towers - Receiving Antennas (Cell, Radio and TV)","1190","1190"
"CW","Towers - Smokestacks or Chimneys (Free Standing) - Masonry","1190","1190"
"CW","Towers - Smokestacks or Chimneys (Free Standing) - Metal","1190","1190"
"CW","Tunnels & Undrgrd Passageways, Incldg Undrgrd Conduits or Pipes (Exclg Mine) - Masonry or Metal","1190","1190"
"CW","Tunnels and Undrgrd Passageways, Incldg Undrgrd Conduits or Pipes (Exclg Mine Passageways) - Wood","1190","1190"
"CW","Water or Sewage Lift Pumps (Enclosed or Open) - Metal or Masonry","1190","1190"
"CW","Water or Sewage Lift Pumps (Enclosed or Open) - Wood or Part Wood","1190","1190"
"CW","Wind Towers - Windmills and wind turbines - tower base of concrete, reinf masonry, steel constrctn","1170","1170"
"CW","Wind Towers - Windmills and wind turbines - other","1170","1170"
